{
  "$schema": "http://json-schema.org/draft-07/schema#",
  "$id": "https://clawrocket.dev/contracts/editorial-room/v0/score_snapshot.schema.json",
  "title": "ScoreSnapshot",
  "description": "Cached score result for a theme/topic/point within a Piece. Stale flag set when setup_version or content_hash diverges. See EDITORIAL_ROOM_CONTRACT.md §4.2.",
  "type": "object",
  "additionalProperties": false,
  "required": [
    "id",
    "piece_id",
    "setup_version",
    "object_kind",
    "object_ref",
    "object_content_hash",
    "scoring_pipeline_slug",
    "selected_persona_slugs",
    "result",
    "computed_at",
    "cost_usd",
    "is_stale"
  ],
  "properties": {
    "id": { "type": "string", "minLength": 1, "description": "ULID." },
    "piece_id": { "type": "string", "minLength": 1 },
    "setup_version": {
      "type": "integer",
      "minimum": 1,
      "description": "Staling key."
    },
    "object_kind": {
      "type": "string",
      "enum": ["theme", "topic", "point"]
    },
    "object_ref": {
      "type": "string",
      "minLength": 1,
      "description": "Slug of the scored object."
    },
    "object_content_hash": {
      "type": "string",
      "minLength": 1,
      "description": "Hash of the object's compiled_truth at score time."
    },
    "scoring_pipeline_slug": { "type": "string", "minLength": 1 },
    "selected_persona_slugs": {
      "type": "array",
      "items": { "type": "string", "minLength": 1 },
      "description": "From SetupState.audience_persona_slugs at score time."
    },
    "result": {
      "$ref": "https://clawrocket.dev/contracts/editorial-room/v0/score_result.schema.json"
    },
    "computed_at": { "type": "string", "format": "date-time" },
    "cost_usd": {
      "anyOf": [{ "type": "null" }, { "type": "number", "minimum": 0 }]
    },
    "is_stale": {
      "type": "boolean",
      "description": "True if setup_version or content_hash diverges from current."
    }
  }
}
