{
  "id": "01HXYZSCRSNAP011UNKNOWNAAAA",
  "piece_id": "piece_01HXYZ789ABC",
  "setup_version": 7,
  "object_kind": "topic",
  "object_ref": "topic/ai-impact-on-game-dev-the-6-person-studio-is-the-new-20-person-studio",
  "object_content_hash": "sha256:topic011hash000000000000000000000000000000000000000000000000000",
  "scoring_pipeline_slug": "scoring_pipeline/gamemakers_default",
  "selected_persona_slugs": [
    "persona/ankit-indie-dev",
    "persona/ravi-studio-lead",
    "persona/mei-publisher"
  ],
  "result": {
    "schema_version": "0",
    "scoring_pipeline_slug": "scoring_pipeline/gamemakers_default",
    "aggregate_score": null,
    "score_scale": [0, 10],
    "score_direction": "higher_better",
    "per_dimension": {},
    "per_persona": null,
    "confidence": "experimental",
    "notes": [
      "unknown — never computed for this object_ref + setup_version + content_hash combination.",
      "User has not yet triggered scoring; render as 'no signal' rather than 'pending'."
    ],
    "per_scorer_breakdown": [],
    "metadata": {
      "cost_usd": 0,
      "latency_ms": 0,
      "models_used": []
    }
  },
  "computed_at": "1970-01-01T00:00:00.000Z",
  "cost_usd": null,
  "is_stale": false
}
