{
  "id": "01HXYZSCRSNAP010PENDINGAAAA",
  "piece_id": "piece_01HXYZ789ABC",
  "setup_version": 7,
  "object_kind": "topic",
  "object_ref": "topic/ai-impact-on-game-dev-how-embracers-writedown-changed-indie-publishing-terms",
  "object_content_hash": "sha256:topic001hash000000000000000000000000000000000000000000000000000",
  "scoring_pipeline_slug": "scoring_pipeline/gamemakers_default",
  "selected_persona_slugs": [
    "persona/ankit-indie-dev",
    "persona/ravi-studio-lead",
    "persona/mei-publisher"
  ],
  "result": {
    "schema_version": "0",
    "scoring_pipeline_slug": "scoring_pipeline/gamemakers_default",
    "aggregate_score": null,
    "score_scale": [0, 10],
    "score_direction": "higher_better",
    "per_dimension": {},
    "per_persona": null,
    "confidence": "experimental",
    "notes": [
      "pending — scoring run in flight (run_id 01HXYZRUNSCR010PENDINGAA)",
      "no aggregate yet; UI should render skeleton/ellipsis."
    ],
    "per_scorer_breakdown": [],
    "metadata": {
      "cost_usd": 0,
      "latency_ms": 0,
      "models_used": []
    }
  },
  "computed_at": "2026-04-30T11:46:55.000Z",
  "cost_usd": null,
  "is_stale": false
}
