{
  "id": "01HXYZSCRSNAP001AAAAAAAAAA",
  "piece_id": "piece_01HXYZ789ABC",
  "setup_version": 7,
  "object_kind": "topic",
  "object_ref": "topic/ai-impact-on-game-dev-how-embracers-writedown-changed-indie-publishing-terms",
  "object_content_hash": "sha256:abc123def456789aaaaaaaaaaaaaaaaaaaaaaaaaaaaaaaaaaaaaaaaaaaaaaaa",
  "scoring_pipeline_slug": "scoring_pipeline/gamemakers_default",
  "selected_persona_slugs": [
    "persona/ankit-indie-dev",
    "persona/ravi-studio-lead",
    "persona/mei-publisher"
  ],
  "result": {
    "schema_version": "0",
    "scoring_pipeline_slug": "scoring_pipeline/gamemakers_default",
    "aggregate_score": 7.8,
    "score_scale": [0, 10],
    "score_direction": "higher_better",
    "per_dimension": {
      "specificity": 8.2,
      "disputability": 7.5,
      "novelty": 8.0,
      "voice_match": 7.6
    },
    "per_persona": {
      "persona/ankit-indie-dev": 9.0,
      "persona/ravi-studio-lead": 9.0,
      "persona/mei-publisher": 7.0
    },
    "confidence": "absolute",
    "notes": [
      "All hard gates pass.",
      "SSR likelihood mean across primary personas: 0.78."
    ],
    "per_scorer_breakdown": [
      {
        "scorer_id": "rubric_judge_opus",
        "role": "score",
        "passed_gate": null,
        "raw_score": 7.6,
        "scale": [0, 10],
        "notes": ["Strong on specificity; weakest on hook freshness."]
      },
      {
        "scorer_id": "ssr_core_local",
        "role": "score",
        "passed_gate": null,
        "raw_score": 8.0,
        "scale": [0, 10],
        "notes": []
      },
      {
        "scorer_id": "voice_drift",
        "role": "score",
        "passed_gate": null,
        "raw_score": 7.8,
        "scale": [0, 10],
        "notes": []
      },
      {
        "scorer_id": "specificity_gate",
        "role": "gate",
        "passed_gate": true,
        "raw_score": null,
        "scale": [0, 10],
        "notes": []
      }
    ],
    "metadata": {
      "cost_usd": 0.064,
      "latency_ms": 11420,
      "models_used": ["claude-opus-4-7", "claude-sonnet-4-6"]
    }
  },
  "computed_at": "2026-04-30T11:47:00.000Z",
  "cost_usd": 0.064,
  "is_stale": false
}
