{
  "id": "01HXYZSCRSNAP013PARTIALAAAA",
  "piece_id": "piece_01HXYZ789ABC",
  "setup_version": 7,
  "object_kind": "topic",
  "object_ref": "topic/ai-impact-on-game-dev-why-ai-art-pl-wins-on-paper-loses-at-funding",
  "object_content_hash": "sha256:topic012hash000000000000000000000000000000000000000000000000000",
  "scoring_pipeline_slug": "scoring_pipeline/gamemakers_default",
  "selected_persona_slugs": [
    "persona/ankit-indie-dev",
    "persona/ravi-studio-lead",
    "persona/mei-publisher"
  ],
  "result": {
    "schema_version": "0",
    "scoring_pipeline_slug": "scoring_pipeline/gamemakers_default",
    "aggregate_score": 6.4,
    "score_scale": [0, 10],
    "score_direction": "higher_better",
    "per_dimension": {
      "specificity": 7.0,
      "disputability": 6.5,
      "novelty": 6.5,
      "voice_match": 6.0
    },
    "per_persona": {
      "persona/ankit-indie-dev": 7.0,
      "persona/ravi-studio-lead": 6.0
    },
    "confidence": "relative-only",
    "notes": [
      "partial — mei-cohort SSR provider (Google) timed out after 10000ms.",
      "Aggregate computed over 2 of 3 primary personas; UI should mark mei column as failed.",
      "Retry mei sub-loop or refresh to recompute fully."
    ],
    "per_scorer_breakdown": [
      {
        "scorer_id": "rubric_judge_opus",
        "role": "score",
        "passed_gate": null,
        "raw_score": 6.5,
        "scale": [0, 10],
        "notes": []
      },
      {
        "scorer_id": "ssr_core_local",
        "role": "score",
        "passed_gate": null,
        "raw_score": 6.5,
        "scale": [0, 10],
        "notes": [
          "ankit + ravi sampled successfully (8 samples each).",
          "mei provider timed out; persona excluded from aggregate."
        ]
      },
      {
        "scorer_id": "voice_drift",
        "role": "score",
        "passed_gate": null,
        "raw_score": 6.0,
        "scale": [0, 10],
        "notes": []
      }
    ],
    "metadata": {
      "cost_usd": 0.048,
      "latency_ms": 12200,
      "models_used": ["claude-opus-4-7", "claude-sonnet-4-6"]
    }
  },
  "computed_at": "2026-04-30T11:51:12.420Z",
  "cost_usd": 0.048,
  "is_stale": false
}
